objectid,youtubeid,title,creator,date,datecreated,subject,location name ,file name ,source,type,format,language,rights ,citation,creative commons,image_alt_text,description,cataloger,,,,,
histoftrktwn_1989_hywf_001,,1989 Hayward Field,,1989,1989,Hayward Field,"Eugene, OR",https://oregondigital.org/concern/images/df668x940,University of Oregon. Libraries. Special Collections and University Archives,Image;StillImage,jpeg,eng,http://rightsstatements.org/vocab/InC/1.0/,"UO Athletics, University of Oregon. ""Hayward Field, 1989"" Oregon Digital. 24 Jan 2024. https://oregondigital.org/concern/images/df668x940","<a href=""http://creativecommons.org/licenses/by-nc-nd/4.0/""target='_blank"">Attribution-NonCommercial-NoDerivs 4.0 International</a>",Landscape image of Hawyard field pre-renovations. Packed grandstands with runners on the track and field. Spencers butte visible in the background.,Still image of Hayward field in 1989 during a track meet. View of of the West grandstand.,Riley Bair,,,,,
histoftrktwn_2008_demd_006,,Daily Emerald - The Hayward Effect,Ashley Chase,2008,6/29/2008,Hayward Field,"Eugene, OR",https://oregondigital.org/concern/documents/9g54xj36p,Oregon Daily Emerald Archives,Text,pdf,eng,http://rightsstatements.org/vocab/InC/1.0/,"Oregon Daily Emerald Archives, University of Oregon. ""Oregon Daily Emerald, June 29, 2008"" Oregon Digital. 05 Feb 2024. https://oregondigital.org/concern/documents/9g54xj36p",,,University of Oregon student newspaper from 2008 discussing the culture and atmosphere at Hayward field.,Riley Bair,,,,,
histoftrktwn_1920_hywf_007,,1920 Hayward Field,,1920,1920,Hayward Field,"Eugene, OR",https://oregondigital.org/concern/images/df669167w,University of Oregon. Libraries. Special Collections and University Archives,Image;StillImage,jpeg,eng,http://rightsstatements.org/vocab/InC/1.0/,"UO Athletics, University of Oregon. ""Hayward Field, ca. 1925"" Oregon Digital. 07 Feb 2024. https://oregondigital.org/concern/images/df669167w",http://creativecommons.org/licenses/by-nc-nd/4.0/,,,Riley Bair,,,,,
histoftrktwn_2008_demd_018,,Daily Emerald - Track Town ,Laura Powers,2008,2008,Eugene as Track Town + Olympics,"Eugene, OR",https://oregondigital.org/concern/documents/fb4948977,,Text,pdf,eng,http://rightsstatements.org/vocab/InC/1.0/,"Oregon Daily Emerald Archives, University of Oregon. ""Oregon Daily Emerald, February 4, 2008"" Oregon Digital. 07 Feb 2024. https://oregondigital.org/concern/documents/fb4948977",,,University of Oregon student newspaper. Discussng track town and olympic trials.,Riley Bair,,,,,
histoftrktwn_2008_demd_019,,Daily Emerald - Runners Paradise ,"Oregon Daily Emerald Publishing Co., Inc.",2008,2008,Eugene,"Eugene, OR",https://oregondigital.org/concern/documents/kp78gg933,Oregon Daily Emerald Archives,Text,pdf,eng,http://rightsstatements.org/vocab/InC/1.0/,"Oregon Daily Emerald Archives, University of Oregon. ""Oregon Daily Emerald, June 28, 2008"" Oregon Digital. 26 Feb 2024. https://oregondigital.org/concern/documents/kp78gg933",,,,Riley Bair,,,,,
histoftrktwn_1975_spre_post_020,,Preforntaine Classic Poster,,1975,1975,Steve Prefontaine,"Eugene, OR",https://oregondigital.org/concern/images/df668z882,"UO Athletics, University of Oregon. ""First annual Steve Prefontaine Classic, 1975"" Oregon Digital. 15 Feb 2024. https://oregondigital.org/concern/images/df668z882",Text,pdf,eng,http://rightsstatements.org/vocab/InC/1.0/,"UO Athletics, University of Oregon. ""First annual Steve Prefontaine Classic, 1975"" Oregon Digital. 26 Feb 2024. https://oregondigital.org/concern/images/df668z882",http://creativecommons.org/licenses/by-nc-nd/4.0/,Black and white five panel graphic filled with pictures of Steve Prefontaine running. ,Poster created for the first Preforntain Classic in honor os the late runner.,Riley Bair,,,,,
histoftrktwn_1970_spre_021,,Steve Prefontaine,,1970,1970,Prefontaine Classic,"Eugene, OR",https://oregondigital.org/concern/images/df668g044,University of Oregon. Libraries. Special Collections and University Archives,Image:StillImage,jpeg,eng,http://rightsstatements.org/vocab/InC/1.0/,"UO Athletics, University of Oregon. ""Steve Prefontaine, 1970-73"" Oregon Digital. 26 Feb 2024. https://oregondigital.org/concern/images/df668g044",http://creativecommons.org/licenses/by-nc-nd/4.0/,Vertical black and white photo of Steve Prefontaine running ahead of fellow Oregon runner. ,"Black and white photo of University of Oregon distance runner Steeve Prefontaine, who competed for the Ducks 1970-73, with a lead over an unidentified teammate during a race at Hayward Field.",Riley Bair,,,,,
,,,,,,,,,,,,,,,,,,,,,,,|